{
  "$schema": "https://json-schema.org/draft/2020-12/schema",
  "$id": "https://github.com/MB3R-Lab/Sheaft/api/schema/report.schema.json",
  "title": "SheaftReport",
  "type": "object",
  "required": [
    "simulation",
    "endpoint_results",
    "summary",
    "policy_evaluation"
  ],
  "properties": {
    "simulation": {
      "type": "object",
      "required": [
        "trials",
        "seed",
        "failure_probability"
      ],
      "properties": {
        "trials": {
          "type": "integer",
          "minimum": 1
        },
        "seed": {
          "type": "integer"
        },
        "failure_probability": {
          "type": "number",
          "minimum": 0,
          "maximum": 1
        }
      }
    },
    "endpoint_results": {
      "type": "array",
      "items": {
        "type": "object",
        "required": [
          "endpoint_id",
          "availability",
          "threshold",
          "status"
        ],
        "properties": {
          "profile": {
            "type": "string"
          },
          "endpoint_id": {
            "type": "string"
          },
          "availability": {
            "type": "number",
            "minimum": 0,
            "maximum": 1
          },
          "threshold": {
            "type": "number",
            "minimum": 0,
            "maximum": 1
          },
          "threshold_delta": {
            "type": "number"
          },
          "status": {
            "type": "string",
            "enum": [
              "pass",
              "warn",
              "fail"
            ]
          }
        }
      }
    },
    "summary": {
      "type": "object",
      "required": [
        "overall_availability",
        "risk_score",
        "confidence"
      ],
      "properties": {
        "overall_availability": {
          "type": "number",
          "minimum": 0,
          "maximum": 1
        },
        "weighted_overall_availability": {
          "type": "number",
          "minimum": 0,
          "maximum": 1
        },
        "cross_profile_availability": {
          "type": "number",
          "minimum": 0,
          "maximum": 1
        },
        "cross_profile_weighted_availability": {
          "type": "number",
          "minimum": 0,
          "maximum": 1
        },
        "risk_score": {
          "type": "number",
          "minimum": 0,
          "maximum": 1
        },
        "confidence": {
          "type": "number",
          "minimum": 0,
          "maximum": 1
        }
      }
    },
    "policy_evaluation": {
      "type": "object",
      "required": [
        "mode",
        "decision",
        "failed_endpoints"
      ],
      "properties": {
        "mode": {
          "type": "string"
        },
        "decision": {
          "type": "string",
          "enum": [
            "pass",
            "warn",
            "fail",
            "report"
          ]
        },
        "failed_endpoints": {
          "type": "array",
          "items": {
            "type": "string"
          }
        },
        "failed_assertions": {
          "type": "array",
          "items": {
            "type": "string"
          }
        },
        "failed_profiles": {
          "type": "array",
          "items": {
            "type": "string"
          }
        },
        "failed_boundaries": {
          "type": "array",
          "items": { "type": "string" }
        },
        "boundary_results": {
          "type": "array",
          "items": { "type": "object" }
        },
        "evaluation_rule": {
          "type": "string"
        },
        "reasons": {
          "type": "array",
          "items": {
            "type": "object",
            "required": [
              "id",
              "scope",
              "status",
              "message"
            ],
            "properties": {
              "id": {
                "type": "string"
              },
              "scope": {
                "type": "string"
              },
              "profile": {
                "type": "string"
              },
              "sweep": {
                "type": "string"
              },
              "baseline": {
                "type": "string"
              },
              "endpoint_id": {
                "type": "string"
              },
              "metric": {
                "type": "string"
              },
              "status": {
                "type": "string"
              },
              "availability": {
                "type": "number"
              },
              "threshold": {
                "type": "number"
              },
              "delta": {
                "type": "number"
              },
              "message": {
                "type": "string"
              }
            }
          }
        }
      }
    },
    "input_artifact": {
      "type": "object"
    },
    "contract_policy": {
      "type": "object",
      "required": [
        "status",
        "action"
      ],
      "properties": {
        "status": {
          "type": "string",
          "enum": [
            "current",
            "deprecated"
          ]
        },
        "action": {
          "type": "string",
          "enum": [
            "allow",
            "warn",
            "fail"
          ]
        },
        "message": {
          "type": "string"
        }
      }
    },
    "provenance": {
      "type": "object"
    },
    "parameters": {
      "type": "object"
    },
    "profiles": {
      "type": "array"
    },
    "sweeps": {
      "type": "array",
      "items": {
        "type": "object",
        "required": ["name", "base_profile", "axis_type", "trials", "seed", "confidence_level", "fingerprint", "points", "boundaries"]
      }
    },
    "importance": {
      "type": "array",
      "items": { "$ref": "importance.schema.json" }
    },
    "diffs": {
      "type": "object"
    },
    "generated_at": {
      "type": "string"
    },
    "recompute_duration_ms": {
      "type": "integer",
      "minimum": 0
    }
  }
}
